{
  "$schema": "https://sethmay.github.io/open-scout-api/schema/v1/oa-lodge.schema.json",
  "id": "cowikee",
  "kind": "oa-lodge",
  "versions": [
    {
      "valid_from": null,
      "valid_to": null,
      "name": "Cowikee",
      "number": null,
      "council": "council:alabama-florida",
      "section": "E4",
      "region": "E",
      "hq_city": "Dothan",
      "hq_state": "AL",
      "lat": 31.2394261,
      "lon": -85.49895409999999,
      "website": "http://www.cowikee.org",
      "provenance": {
        "sources": [
          {
            "url": "https://oa-bsa.org/app/lodge-map/council_data.json"
          }
        ],
        "method": "official_publication",
        "verified_at": "2026-07-21",
        "confidence": 1.0,
        "notes": "Official OA lodge locator feed (snapshot 2026-07-21); chartering council linked by council number. Officer names and contact emails excluded as PII."
      }
    }
  ],
  "notes": null
}
