{
  "$schema": "https://sethmay.github.io/open-scout-api/schema/v1/oa-lodge.schema.json",
  "id": "tom-kita-chara",
  "kind": "oa-lodge",
  "versions": [
    {
      "valid_from": null,
      "valid_to": null,
      "name": "Tom Kita Chara",
      "number": null,
      "council": "council:samoset",
      "section": "G10",
      "region": "G",
      "hq_city": "Weston",
      "hq_state": "WI",
      "lat": 44.9243013,
      "lon": -89.57113969999999,
      "website": "http://tkclodge.org",
      "provenance": {
        "sources": [
          {
            "url": "https://oa-bsa.org/app/lodge-map/council_data.json"
          }
        ],
        "method": "official_publication",
        "verified_at": "2026-07-21",
        "confidence": 1.0,
        "notes": "Official OA lodge locator feed (snapshot 2026-07-21); chartering council linked by council number. Officer names and contact emails excluded as PII."
      }
    }
  ],
  "notes": null
}
