{
  "$schema": "https://sethmay.github.io/open-scout-api/schema/v1/oa-lodge.schema.json",
  "id": "aal-pa-tah",
  "kind": "oa-lodge",
  "versions": [
    {
      "valid_from": null,
      "valid_to": null,
      "name": "Aal-Pa-Tah",
      "number": null,
      "council": "council:gulf-stream",
      "section": "E5",
      "region": "E",
      "hq_city": "Palm Beach Gardens",
      "hq_state": "FL",
      "lat": 26.7993434,
      "lon": -80.1072863,
      "website": "http://www.aalpatah.org",
      "provenance": {
        "sources": [
          {
            "url": "https://oa-bsa.org/app/lodge-map/council_data.json"
          }
        ],
        "method": "official_publication",
        "verified_at": "2026-07-21",
        "confidence": 1.0,
        "notes": "Official OA lodge locator feed (snapshot 2026-07-21); chartering council linked by council number. Officer names and contact emails excluded as PII."
      }
    }
  ],
  "notes": null
}
