{
  "$schema": "https://sethmay.github.io/open-scout-api/schema/v1/oa-lodge.schema.json",
  "id": "marnoc",
  "kind": "oa-lodge",
  "versions": [
    {
      "valid_from": null,
      "valid_to": null,
      "name": "Marnoc",
      "number": null,
      "council": "council:great-trail",
      "section": "E13",
      "region": "E",
      "hq_city": "Stow",
      "hq_state": "OH",
      "lat": 41.1893568,
      "lon": -81.46568359999999,
      "website": "http://www.marnoc.org",
      "provenance": {
        "sources": [
          {
            "url": "https://oa-bsa.org/app/lodge-map/council_data.json"
          }
        ],
        "method": "official_publication",
        "verified_at": "2026-07-21",
        "confidence": 1.0,
        "notes": "Official OA lodge locator feed (snapshot 2026-07-21); chartering council linked by council number. Officer names and contact emails excluded as PII."
      }
    }
  ],
  "notes": null
}
