{
  "$schema": "https://sethmay.github.io/open-scout-api/schema/v1/oa-lodge.schema.json",
  "id": "na-tsi-hi",
  "kind": "oa-lodge",
  "versions": [
    {
      "valid_from": null,
      "valid_to": null,
      "name": "Na Tsi Hi",
      "number": null,
      "council": "council:monmouth",
      "section": "E17",
      "region": "E",
      "hq_city": "Morganville",
      "hq_state": "NJ",
      "lat": 40.3518564,
      "lon": -74.29303170000001,
      "website": "http://www.NaTsiHi.org",
      "provenance": {
        "sources": [
          {
            "url": "https://oa-bsa.org/app/lodge-map/council_data.json"
          }
        ],
        "method": "official_publication",
        "verified_at": "2026-07-21",
        "confidence": 1.0,
        "notes": "Official OA lodge locator feed (snapshot 2026-07-21); chartering council linked by council number. Officer names and contact emails excluded as PII."
      }
    }
  ],
  "notes": null
}
