{
  "$schema": "https://sethmay.github.io/open-scout-api/schema/v1/oa-lodge.schema.json",
  "id": "apoxky-aio",
  "kind": "oa-lodge",
  "versions": [
    {
      "valid_from": null,
      "valid_to": null,
      "name": "Apoxky Aio",
      "number": null,
      "council": "council:montana",
      "section": "G12N",
      "region": "G",
      "hq_city": "Great Falls",
      "hq_state": "MT",
      "lat": 47.4872212,
      "lon": -111.2927662,
      "website": "https://www.apoxkyaio.com",
      "provenance": {
        "sources": [
          {
            "url": "https://oa-bsa.org/app/lodge-map/council_data.json"
          }
        ],
        "method": "official_publication",
        "verified_at": "2026-07-21",
        "confidence": 1.0,
        "notes": "Official OA lodge locator feed (snapshot 2026-07-21); chartering council linked by council number. Officer names and contact emails excluded as PII."
      }
    }
  ],
  "notes": null
}
