{
  "$schema": "https://sethmay.github.io/open-scout-api/schema/v1/oa-lodge.schema.json",
  "id": "black-eagle",
  "kind": "oa-lodge",
  "versions": [
    {
      "valid_from": null,
      "valid_to": null,
      "name": "Black Eagle",
      "number": null,
      "council": "council:transatlantic",
      "section": "E17",
      "region": "E",
      "hq_city": "APO",
      "hq_state": "AE",
      "lat": 50.8633682,
      "lon": 4.4323362,
      "website": "https://tacscouting.org/activities/oa",
      "provenance": {
        "sources": [
          {
            "url": "https://oa-bsa.org/app/lodge-map/council_data.json"
          }
        ],
        "method": "official_publication",
        "verified_at": "2026-07-21",
        "confidence": 1.0,
        "notes": "Official OA lodge locator feed (snapshot 2026-07-21); chartering council linked by council number. Officer names and contact emails excluded as PII."
      }
    }
  ],
  "notes": null
}
