{
  "$schema": "https://sethmay.github.io/open-scout-api/schema/v1/oa-lodge.schema.json",
  "id": "kanwa-tho",
  "kind": "oa-lodge",
  "versions": [
    {
      "valid_from": null,
      "valid_to": null,
      "name": "Kanwa Tho",
      "number": null,
      "council": "council:three-harbors",
      "section": "G9",
      "region": "G",
      "hq_city": "Milwaukee",
      "hq_state": "WI",
      "lat": 43.02810909999999,
      "lon": -88.01675159999999,
      "website": "http://www.kanwatho.org",
      "provenance": {
        "sources": [
          {
            "url": "https://oa-bsa.org/app/lodge-map/council_data.json"
          }
        ],
        "method": "official_publication",
        "verified_at": "2026-07-21",
        "confidence": 1.0,
        "notes": "Official OA lodge locator feed (snapshot 2026-07-21); chartering council linked by council number. Officer names and contact emails excluded as PII."
      }
    }
  ],
  "notes": null
}
