{
  "$schema": "https://sethmay.github.io/open-scout-api/schema/v1/oa-lodge.schema.json",
  "id": "blue-ox",
  "kind": "oa-lodge",
  "versions": [
    {
      "valid_from": null,
      "valid_to": null,
      "name": "Blue Ox",
      "number": null,
      "council": "council:gamehaven",
      "section": "G10",
      "region": "G",
      "hq_city": "Rochester",
      "hq_state": "MN",
      "lat": 44.050329,
      "lon": -92.45482799999999,
      "website": "https://gamehavenbsa.org/resources/for-scouts/oa",
      "provenance": {
        "sources": [
          {
            "url": "https://oa-bsa.org/app/lodge-map/council_data.json"
          }
        ],
        "method": "official_publication",
        "verified_at": "2026-07-21",
        "confidence": 1.0,
        "notes": "Official OA lodge locator feed (snapshot 2026-07-21); chartering council linked by council number. Officer names and contact emails excluded as PII."
      }
    }
  ],
  "notes": null
}
