{
  "$schema": "https://sethmay.github.io/open-scout-api/schema/v1/oa-lodge.schema.json",
  "id": "atchafalaya",
  "kind": "oa-lodge",
  "versions": [
    {
      "valid_from": null,
      "valid_to": null,
      "name": "Atchafalaya",
      "number": null,
      "council": "council:evangeline-area",
      "section": "G1",
      "region": "G",
      "hq_city": "Lafayette",
      "hq_state": "LA",
      "lat": 30.1877881,
      "lon": -92.0007929,
      "website": "https://www.eacscouting.org/oa",
      "provenance": {
        "sources": [
          {
            "url": "https://oa-bsa.org/app/lodge-map/council_data.json"
          }
        ],
        "method": "official_publication",
        "verified_at": "2026-07-21",
        "confidence": 1.0,
        "notes": "Official OA lodge locator feed (snapshot 2026-07-21); chartering council linked by council number. Officer names and contact emails excluded as PII."
      }
    }
  ],
  "notes": null
}
